{"schema_version": "1.0", "scenario_id": "SCN_0001", "ground_truth_rules": [{"secret": "must not reach current public requirements"}], "source_order_id": "00187747", "source_order_key": "00106330", "source_article_ids": ["00106075", "00102366", "00102366", "00110601", "00110601", "00102099", "00102099", "00102099", "00106525", "00105119", "00105119", "00106538", "00106538", "00110320", "00110320", "00111831"], "source_sequence_positions": [35, 36, 37, 38, 39, 40, 41, 42, 43, 44, 45, 46, 47, 48, 49, 50], "split": "train", "split_group_id": "TRAIN", "reference_feasible_plan_id": "private-answer"}