{
  "schema_version": "1.0",
  "scenario_id": "SCN_0054",
  "ground_truth_rules": [
    {
      "rule_type": "category_group",
      "target_attribute": "product_category=electronics",
      "priority": 1,
      "hard_or_soft": "soft",
      "thresholds": {},
      "canonical": "电子产品箱应尽量集中码放。",
      "paraphrases": [
        "请把电子类货箱放得相对集中。",
        "尽量不要把电子产品分散在托盘各处。"
      ]
    }
  ],
  "source_order_id": "00168764",
  "source_order_key": "00106649",
  "source_article_ids": [
    "00108137",
    "00108137",
    "00111175",
    "00108074",
    "00108074",
    "00101359",
    "00101359",
    "00102434",
    "00111835",
    "00106011",
    "00106011",
    "00103728",
    "00100741",
    "00112256",
    "00104334",
    "00104334",
    "00104334"
  ],
  "source_sequence_positions": [
    5,
    6,
    7,
    8,
    9,
    10,
    11,
    12,
    13,
    14,
    15,
    16,
    17,
    18,
    19,
    20,
    21
  ],
  "split": "validation",
  "split_group_id": "VALIDATION",
  "reference_feasible_plan_id": "PLAN_0054"
}
